{"catalogHash":"sha256:f382fce1b998fb60633fb73f0c4aa5eedb0ac7103734c48253e1be2440cd00a2","nodes":{"Robot.Connection.IsHandshakeComplete":{"kind":"sensor","maxAgeMs":1000,"type":"bool"},"Robot.Connection.IsOnline":{"kind":"sensor","maxAgeMs":1000,"type":"bool"},"Robot.Connection.LastSampleAgeMs":{"kind":"sensor","maxAgeMs":1000,"type":"float64","unit":"ms"},"Robot.Identity.Backend":{"kind":"attribute","type":"enum","values":["SIM","REAL"]},"Robot.Identity.Id":{"kind":"attribute","type":"string"},"Robot.Identity.Model":{"kind":"attribute","type":"string"},"Robot.Identity.ProfileId":{"kind":"attribute","type":"string"},"Robot.Imu.AngularVelocity.X":{"kind":"sensor","maxAgeMs":200,"type":"float64","unit":"rad/s"},"Robot.Imu.AngularVelocity.Y":{"kind":"sensor","maxAgeMs":200,"type":"float64","unit":"rad/s"},"Robot.Imu.AngularVelocity.Z":{"kind":"sensor","maxAgeMs":200,"type":"float64","unit":"rad/s"},"Robot.Imu.LinearAcceleration.X":{"kind":"sensor","maxAgeMs":200,"type":"float64","unit":"m/s²"},"Robot.Imu.LinearAcceleration.Y":{"kind":"sensor","maxAgeMs":200,"type":"float64","unit":"m/s²"},"Robot.Imu.LinearAcceleration.Z":{"kind":"sensor","maxAgeMs":200,"type":"float64","unit":"m/s²"},"Robot.Imu.Orientation.Pitch":{"kind":"sensor","maxAgeMs":200,"type":"float64","unit":"rad"},"Robot.Imu.Orientation.Roll":{"kind":"sensor","maxAgeMs":200,"type":"float64","unit":"rad"},"Robot.Imu.Orientation.Yaw":{"kind":"sensor","maxAgeMs":200,"type":"float64","unit":"rad"},"Robot.Leg.FrontLeft.Foot.ContactForce":{"kind":"sensor","maxAgeMs":200,"type":"float64","unit":"N"},"Robot.Leg.FrontLeft.Foot.IsInContact":{"kind":"sensor","maxAgeMs":200,"type":"bool"},"Robot.Leg.FrontLeft.Joint.Calf.Effort":{"kind":"sensor","maxAgeMs":200,"type":"float64","unit":"N·m"},"Robot.Leg.FrontLeft.Joint.Calf.Position":{"kind":"sensor","maxAgeMs":200,"type":"float64","unit":"rad"},"Robot.Leg.FrontLeft.Joint.Calf.Velocity":{"kind":"sensor","maxAgeMs":200,"type":"float64","unit":"rad/s"},"Robot.Leg.FrontLeft.Joint.Hip.Effort":{"kind":"sensor","maxAgeMs":200,"type":"float64","unit":"N·m"},"Robot.Leg.FrontLeft.Joint.Hip.Position":{"kind":"sensor","maxAgeMs":200,"type":"float64","unit":"rad"},"Robot.Leg.FrontLeft.Joint.Hip.Velocity":{"kind":"sensor","maxAgeMs":200,"type":"float64","unit":"rad/s"},"Robot.Leg.FrontLeft.Joint.Thigh.Effort":{"kind":"sensor","maxAgeMs":200,"type":"float64","unit":"N·m"},"Robot.Leg.FrontLeft.Joint.Thigh.Position":{"kind":"sensor","maxAgeMs":200,"type":"float64","unit":"rad"},"Robot.Leg.FrontLeft.Joint.Thigh.Velocity":{"kind":"sensor","maxAgeMs":200,"type":"float64","unit":"rad/s"},"Robot.Leg.FrontRight.Foot.ContactForce":{"kind":"sensor","maxAgeMs":200,"type":"float64","unit":"N"},"Robot.Leg.FrontRight.Foot.IsInContact":{"kind":"sensor","maxAgeMs":200,"type":"bool"},"Robot.Leg.FrontRight.Joint.Calf.Effort":{"kind":"sensor","maxAgeMs":200,"type":"float64","unit":"N·m"},"Robot.Leg.FrontRight.Joint.Calf.Position":{"kind":"sensor","maxAgeMs":200,"type":"float64","unit":"rad"},"Robot.Leg.FrontRight.Joint.Calf.Velocity":{"kind":"sensor","maxAgeMs":200,"type":"float64","unit":"rad/s"},"Robot.Leg.FrontRight.Joint.Hip.Effort":{"kind":"sensor","maxAgeMs":200,"type":"float64","unit":"N·m"},"Robot.Leg.FrontRight.Joint.Hip.Position":{"kind":"sensor","maxAgeMs":200,"type":"float64","unit":"rad"},"Robot.Leg.FrontRight.Joint.Hip.Velocity":{"kind":"sensor","maxAgeMs":200,"type":"float64","unit":"rad/s"},"Robot.Leg.FrontRight.Joint.Thigh.Effort":{"kind":"sensor","maxAgeMs":200,"type":"float64","unit":"N·m"},"Robot.Leg.FrontRight.Joint.Thigh.Position":{"kind":"sensor","maxAgeMs":200,"type":"float64","unit":"rad"},"Robot.Leg.FrontRight.Joint.Thigh.Velocity":{"kind":"sensor","maxAgeMs":200,"type":"float64","unit":"rad/s"},"Robot.Leg.RearLeft.Foot.ContactForce":{"kind":"sensor","maxAgeMs":200,"type":"float64","unit":"N"},"Robot.Leg.RearLeft.Foot.IsInContact":{"kind":"sensor","maxAgeMs":200,"type":"bool"},"Robot.Leg.RearLeft.Joint.Calf.Effort":{"kind":"sensor","maxAgeMs":200,"type":"float64","unit":"N·m"},"Robot.Leg.RearLeft.Joint.Calf.Position":{"kind":"sensor","maxAgeMs":200,"type":"float64","unit":"rad"},"Robot.Leg.RearLeft.Joint.Calf.Velocity":{"kind":"sensor","maxAgeMs":200,"type":"float64","unit":"rad/s"},"Robot.Leg.RearLeft.Joint.Hip.Effort":{"kind":"sensor","maxAgeMs":200,"type":"float64","unit":"N·m"},"Robot.Leg.RearLeft.Joint.Hip.Position":{"kind":"sensor","maxAgeMs":200,"type":"float64","unit":"rad"},"Robot.Leg.RearLeft.Joint.Hip.Velocity":{"kind":"sensor","maxAgeMs":200,"type":"float64","unit":"rad/s"},"Robot.Leg.RearLeft.Joint.Thigh.Effort":{"kind":"sensor","maxAgeMs":200,"type":"float64","unit":"N·m"},"Robot.Leg.RearLeft.Joint.Thigh.Position":{"kind":"sensor","maxAgeMs":200,"type":"float64","unit":"rad"},"Robot.Leg.RearLeft.Joint.Thigh.Velocity":{"kind":"sensor","maxAgeMs":200,"type":"float64","unit":"rad/s"},"Robot.Leg.RearRight.Foot.ContactForce":{"kind":"sensor","maxAgeMs":200,"type":"float64","unit":"N"},"Robot.Leg.RearRight.Foot.IsInContact":{"kind":"sensor","maxAgeMs":200,"type":"bool"},"Robot.Leg.RearRight.Joint.Calf.Effort":{"kind":"sensor","maxAgeMs":200,"type":"float64","unit":"N·m"},"Robot.Leg.RearRight.Joint.Calf.Position":{"kind":"sensor","maxAgeMs":200,"type":"float64","unit":"rad"},"Robot.Leg.RearRight.Joint.Calf.Velocity":{"kind":"sensor","maxAgeMs":200,"type":"float64","unit":"rad/s"},"Robot.Leg.RearRight.Joint.Hip.Effort":{"kind":"sensor","maxAgeMs":200,"type":"float64","unit":"N·m"},"Robot.Leg.RearRight.Joint.Hip.Position":{"kind":"sensor","maxAgeMs":200,"type":"float64","unit":"rad"},"Robot.Leg.RearRight.Joint.Hip.Velocity":{"kind":"sensor","maxAgeMs":200,"type":"float64","unit":"rad/s"},"Robot.Leg.RearRight.Joint.Thigh.Effort":{"kind":"sensor","maxAgeMs":200,"type":"float64","unit":"N·m"},"Robot.Leg.RearRight.Joint.Thigh.Position":{"kind":"sensor","maxAgeMs":200,"type":"float64","unit":"rad"},"Robot.Leg.RearRight.Joint.Thigh.Velocity":{"kind":"sensor","maxAgeMs":200,"type":"float64","unit":"rad/s"},"Robot.Motion.Perform":{"args":{"Name":{"type":"enum","values":["CROUCH","BOW","TILT","LIFT_FRONT_LEFT","JUMP"]}},"kind":"command","preconditions":"MANUAL; standing; healthy; motion capability and scene guards","timeoutMs":15000},"Robot.Motion.Perform.Status.ExecutionId":{"generated":true,"kind":"sensor","maxAgeMs":1000,"type":"string"},"Robot.Motion.Perform.Status.Phase":{"generated":true,"kind":"sensor","maxAgeMs":1000,"type":"enum","values":["NONE","PENDING","ACCEPTED","RUNNING","SUCCEEDED","FAILED","REJECTED","CANCELLED","TIMED_OUT"]},"Robot.Motion.Perform.Status.Reason":{"generated":true,"kind":"sensor","maxAgeMs":1000,"type":"string"},"Robot.Motion.Velocity":{"fields":{"AngularZ":{"max":0.65,"min":-0.65,"type":"float64","unit":"rad/s"},"LinearX":{"max":0.5,"min":-0.5,"type":"float64","unit":"m/s"}},"kind":"setpoint","refreshHz":20,"safeValue":{"AngularZ":0,"LinearX":0},"ttlMs":300},"Robot.Navigation.FollowRoute":{"args":{"RouteId":{"type":"string"}},"kind":"command","preconditions":"MANUAL; versioned route exists; map ready","timeoutMs":120000},"Robot.Navigation.FollowRoute.Status.ExecutionId":{"generated":true,"kind":"sensor","maxAgeMs":1000,"type":"string"},"Robot.Navigation.FollowRoute.Status.Phase":{"generated":true,"kind":"sensor","maxAgeMs":1000,"type":"enum","values":["NONE","PENDING","ACCEPTED","RUNNING","SUCCEEDED","FAILED","REJECTED","CANCELLED","TIMED_OUT"]},"Robot.Navigation.FollowRoute.Status.Reason":{"generated":true,"kind":"sensor","maxAgeMs":1000,"type":"string"},"Robot.Navigation.GoTo":{"args":{"X":{"type":"float64","unit":"m"},"Y":{"type":"float64","unit":"m"}},"kind":"command","preconditions":"MANUAL; scene and map frame ready","timeoutMs":60000},"Robot.Navigation.GoTo.Status.ExecutionId":{"generated":true,"kind":"sensor","maxAgeMs":1000,"type":"string"},"Robot.Navigation.GoTo.Status.Phase":{"generated":true,"kind":"sensor","maxAgeMs":1000,"type":"enum","values":["NONE","PENDING","ACCEPTED","RUNNING","SUCCEEDED","FAILED","REJECTED","CANCELLED","TIMED_OUT"]},"Robot.Navigation.GoTo.Status.Reason":{"generated":true,"kind":"sensor","maxAgeMs":1000,"type":"string"},"Robot.Perception.Marker.Count":{"kind":"sensor","maxAgeMs":1000,"type":"uint32"},"Robot.Perception.Marker.IsDetected":{"kind":"sensor","maxAgeMs":1000,"type":"bool"},"Robot.Perception.Obstacle.FrontMinDistance":{"kind":"sensor","maxAgeMs":500,"type":"float64","unit":"m"},"Robot.Perception.Obstacle.MinDistance":{"kind":"sensor","maxAgeMs":500,"type":"float64","unit":"m"},"Robot.Pose.Orientation.Pitch":{"frame":"odom","kind":"sensor","maxAgeMs":200,"type":"float64","unit":"rad"},"Robot.Pose.Orientation.Roll":{"frame":"odom","kind":"sensor","maxAgeMs":200,"type":"float64","unit":"rad"},"Robot.Pose.Orientation.Yaw":{"frame":"odom","kind":"sensor","maxAgeMs":200,"type":"float64","unit":"rad"},"Robot.Pose.Position.X":{"frame":"odom","kind":"sensor","maxAgeMs":200,"type":"float64","unit":"m"},"Robot.Pose.Position.Y":{"frame":"odom","kind":"sensor","maxAgeMs":200,"type":"float64","unit":"m"},"Robot.Pose.Position.Z":{"frame":"odom","kind":"sensor","maxAgeMs":200,"type":"float64","unit":"m"},"Robot.PowerSystem.Battery.Current":{"kind":"sensor","maxAgeMs":2500,"type":"float64","unit":"A"},"Robot.PowerSystem.Battery.IsCharging":{"kind":"sensor","maxAgeMs":2500,"type":"bool"},"Robot.PowerSystem.Battery.StateOfCharge":{"kind":"sensor","maxAgeMs":2500,"type":"float64","unit":"%"},"Robot.PowerSystem.Battery.Voltage":{"kind":"sensor","maxAgeMs":2500,"type":"float64","unit":"V"},"Robot.Safety.Arm":{"args":{},"kind":"command","preconditions":"SIM; DISARMED; healthy sensors; explicit run authorization","timeoutMs":3000},"Robot.Safety.Arm.Status.ExecutionId":{"generated":true,"kind":"sensor","maxAgeMs":1000,"type":"string"},"Robot.Safety.Arm.Status.Phase":{"generated":true,"kind":"sensor","maxAgeMs":1000,"type":"enum","values":["NONE","PENDING","ACCEPTED","RUNNING","SUCCEEDED","FAILED","REJECTED","CANCELLED","TIMED_OUT"]},"Robot.Safety.Arm.Status.Reason":{"gener